<?xml version="1.0" encoding="utf-8"?><dd:DataDescription xmlns:dd="http://keg.vse.cz/ns/datadescription0_1" xmlns:xsi="http://www.w3.org/2001/XMLSchema-instance" xmlns:pmml="http://www.dmg.org/PMML-4_0" xsi:schemaLocation="http://keg.vse.cz/ns/datadescription0_1 http://sewebar.vse.cz/schemas/DataDescription0_1.xsd"><Dictionary numberOfFields="10" sourceType="PMML" sourceName="/pmml:PMML/pmml:Header/pmml:Extension[@name='metabase']/@value"><Field name="Age" optype="continuous" dataType="integer">
			
			
			<Interval closure="closedClosed" leftMargin="21.000000" rightMargin="67.000000"/>
		</Field><Field name="amount" optype="continuous" dataType="integer">
			
			
			<Interval closure="closedClosed" leftMargin="4980.000000" rightMargin="590820.000000"/>
		</Field><Field name="birth_number" optype="continuous" dataType="integer">
			
			
			<Interval closure="closedClosed" leftMargin="350129.000000" rightMargin="806207.000000"/>
		</Field><Field name="District" optype="categorical" dataType="string">
			
				<Category>Benesov</Category>
				<Category>Beroun</Category>
				<Category>Blansko</Category>
				<Category>Breclav</Category>
				<Category>Brno</Category>
				<Category>Brno - venkov</Category>
				<Category>Bruntal</Category>
				<Category>Ceska Lipa</Category>
				<Category>Ceske Budejovice</Category>
				<Category>Cesky Krumlov</Category>
				<Category>Decin</Category>
				<Category>Domazlice</Category>
				<Category>Frydek - Mistek</Category>
				<Category>Havlickuv Brod</Category>
				<Category>Hodonin</Category>
				<Category>Hradec Kralove</Category>
				<Category>Cheb</Category>
				<Category>Chomutov</Category>
				<Category>Chrudim</Category>
				<Category>Jablonec n. Nisou</Category>
				<Category>Jesenik</Category>
				<Category>Jicin</Category>
				<Category>Jihlava</Category>
				<Category>Jindrichuv Hradec</Category>
				<Category>Karlovy Vary</Category>
				<Category>Karvina</Category>
				<Category>Kladno</Category>
				<Category>Klatovy</Category>
				<Category>Kolin</Category>
				<Category>Kromeriz</Category>
				<Category>Kutna Hora</Category>
				<Category>Liberec</Category>
				<Category>Litomerice</Category>
				<Category>Louny</Category>
				<Category>Melnik</Category>
				<Category>Mlada Boleslav</Category>
				<Category>Most</Category>
				<Category>Nachod</Category>
				<Category>Novy Jicin</Category>
				<Category>Nymburk</Category>
				<Category>Olomouc</Category>
				<Category>Opava</Category>
				<Category>Ostrava - mesto</Category>
				<Category>Pardubice</Category>
				<Category>Pelhrimov</Category>
				<Category>Pisek</Category>
				<Category>Plzen</Category>
				<Category>Plzen - jih</Category>
				<Category>Plzen - sever</Category>
				<Category>Praha</Category>
				<Category>Praha - vychod</Category>
				<Category>Praha - zapad</Category>
				<Category>Prachatice</Category>
				<Category>Prerov</Category>
				<Category>Pribram</Category>
				<Category>Prostejov</Category>
				<Category>Rakovnik</Category>
				<Category>Rokycany</Category>
				<Category>Rychnov nad Kneznou</Category>
				<Category>Semily</Category>
				<Category>Sokolov</Category>
				<Category>Strakonice</Category>
				<Category>Sumperk</Category>
				<Category>Svitavy</Category>
				<Category>Tabor</Category>
				<Category>Tachov</Category>
				<Category>Teplice</Category>
				<Category>Trebic</Category>
				<Category>Trutnov</Category>
				<Category>Uherske Hradiste</Category>
				<Category>Usti nad Labem</Category>
				<Category>Usti nad Orlici</Category>
				<Category>Vsetin</Category>
				<Category>Vyskov</Category>
				<Category>Zdar nad Sazavou</Category>
				<Category>Zlin</Category>
				<Category>Znojmo</Category>
		</Field><Field name="duration" optype="continuous" dataType="integer">
			
			
			<Interval closure="closedClosed" leftMargin="12.000000" rightMargin="60.000000"/>
		</Field><Field name="loan_id" optype="continuous" dataType="integer">
			
			
			
			
			<Interval closure="closedClosed" leftMargin="4959.000000" rightMargin="19627.000000"/>
		</Field><Field name="payments" optype="continuous" dataType="integer">
			
			
			<Interval closure="closedClosed" leftMargin="304.000000" rightMargin="41728.000000"/>
		</Field><Field name="Salary" optype="continuous" dataType="integer">
			
			
			<Interval closure="closedClosed" leftMargin="8110.000000" rightMargin="12541.000000"/>
		</Field><Field name="Sex" optype="categorical" dataType="string">
			
				<Category>Yes</Category>
				<Category>No</Category>
		</Field><Field name="status" optype="categorical" dataType="string">
			
				<Category>A</Category>
				<Category>B</Category>
				<Category>C</Category>
				<Category>D</Category>
		</Field></Dictionary></dd:DataDescription>
